{
  "schema_version": "1.0.0",
  "fixed_volume": "SCROLLS_HEL_4.681um_113keV_1.2m_binmean_2_PHerc_0500P2_HA_0001_masked",
  "transformation_matrix": [
    [
      -0.22668740143479876,
      0.06829000653424222,
      -0.01838088604499233,
      3654.690187878843
    ],
    [
      -0.07094406316509316,
      -0.21952731717684904,
      0.05474403624931551,
      3571.0835279760922
    ],
    [
      -0.0012371029641354003,
      0.05737681441756459,
      0.23042731975594216,
      159.17139938311448
    ]
  ],
  "fixed_landmarks": [
    [
      2108.0,
      1708.1893310546875,
      5029.95947265625
    ],
    [
      2335.000244140625,
      1925.0029296875,
      3368.0517578125
    ],
    [
      2324.0,
      1546.018798828125,
      1918.159423828125
    ],
    [
      1320.662109375,
      1464.2928466796875,
      2781.0
    ]
  ],
  "moving_landmarks": [
    [
      8446.2822265625,
      10393.548828125,
      18595.400390625
    ],
    [
      7298.7431640625,
      8117.9765625,
      11943.5751953125
    ],
    [
      7851.0322265625,
      8098.69775390625,
      5659.1513671875
    ],
    [
      11966.1630859375,
      8081.46337890625,
      9430.0595703125
    ]
  ]
}